{
  "schemaVersion": "1",
  "release": {
    "version": "0.7.4",
    "tag": "v0.7.4",
    "commit": "ce34437e6ebf1cdaf5e55d40dc36e16c692875d5"
  },
  "host": {
    "name": "codex",
    "version": "0.149.0",
    "operatingSystem": "linux",
    "architecture": "x86_64",
    "shell": "bash 5.3.9"
  },
  "installation": {
    "method": "Local marketplace install in a disposable bubblewrap view with existing authentication bound read-only.",
    "targetPluginVersion": "0.7.4",
    "installedSnapshotVerified": true
  },
  "hook": {
    "event": "SessionStart",
    "matcher": "startup|resume|clear|compact",
    "expectedCommandSha256": "150a6a723b97158cd2d83ea1e5687fc31840ab403cf3563bbd9dd1369b8192cf",
    "installedCommandSha256": "150a6a723b97158cd2d83ea1e5687fc31840ab403cf3563bbd9dd1369b8192cf",
    "installedCommandVerified": true
  },
  "reporter": {
    "identity": "anonymous",
    "anonymous": true
  },
  "recordedAt": "2026-08-21T15:46:28Z",
  "cases": [
    {
      "id": "startup-routed",
      "sessionKind": "fresh",
      "lifecycleSource": "startup",
      "compactionMode": "not-applicable",
      "request": "Read-only routing check. I want to audit the AGENTS.md architecture of a sample repository. Apply startup routing guidance, but do not perform the audit or mutate anything.",
      "expectedRoute": "agents-architect",
      "observedRoute": "agents-architect",
      "noRouteControl": false,
      "inspected": [
        "Installed Axiom v0.7.4 manifest and SessionStart hook",
        "Host final response"
      ],
      "mutationAttempted": false,
      "mutationObserved": false,
      "result": "pass",
      "limitations": [
        "The isolated binary view did not expose the optional code-mode host; this prompt prohibited commands and did not rely on code mode."
      ],
      "supportingOutput": [
        "ROUTE=agents-architect",
        "STARTUP_FRONT_DOOR=LOADED"
      ]
    },
    {
      "id": "startup-no-route",
      "sessionKind": "fresh",
      "lifecycleSource": "startup",
      "compactionMode": "not-applicable",
      "request": "What is two plus two? Apply startup routing guidance. This is only a conceptual arithmetic question; do not mutate anything.",
      "expectedRoute": "none",
      "observedRoute": "none",
      "noRouteControl": true,
      "inspected": [
        "Installed Axiom v0.7.4 manifest and SessionStart hook",
        "Host final response"
      ],
      "mutationAttempted": false,
      "mutationObserved": false,
      "result": "pass",
      "limitations": [
        "The isolated binary view did not expose the optional code-mode host; this prompt prohibited commands and did not rely on code mode."
      ],
      "supportingOutput": [
        "RESULT=4",
        "ROUTE=NONE"
      ]
    },
    {
      "id": "manual-compaction-routed",
      "sessionKind": "post-compaction",
      "lifecycleSource": "compact",
      "compactionMode": "manual",
      "request": "Perform a read-only audit of this repository's AGENTS.md instruction system. Report findings only; do not modify files.",
      "expectedRoute": "agents-architect",
      "observedRoute": null,
      "noRouteControl": false,
      "inspected": [],
      "mutationAttempted": false,
      "mutationObserved": false,
      "result": "not-run",
      "limitations": [
        "The bounded non-interactive validation did not invoke a reviewable manual compaction event."
      ],
      "supportingOutput": []
    },
    {
      "id": "manual-compaction-no-route",
      "sessionKind": "post-compaction",
      "lifecycleSource": "compact",
      "compactionMode": "manual",
      "request": "Summarize the purpose of this README. Do not modify files.",
      "expectedRoute": "none",
      "observedRoute": null,
      "noRouteControl": true,
      "inspected": [],
      "mutationAttempted": false,
      "mutationObserved": false,
      "result": "not-run",
      "limitations": [
        "The bounded non-interactive validation did not invoke a reviewable manual compaction event."
      ],
      "supportingOutput": []
    },
    {
      "id": "automatic-compaction-routed",
      "sessionKind": "post-compaction",
      "lifecycleSource": "compact",
      "compactionMode": "automatic",
      "request": "Perform a read-only audit of this repository's AGENTS.md instruction system. Report findings only; do not modify files.",
      "expectedRoute": "agents-architect",
      "observedRoute": null,
      "noRouteControl": false,
      "inspected": [],
      "mutationAttempted": false,
      "mutationObserved": false,
      "result": "not-run",
      "limitations": [
        "The bounded non-interactive validation did not produce a reviewable automatic-compaction event."
      ],
      "supportingOutput": []
    },
    {
      "id": "automatic-compaction-no-route",
      "sessionKind": "post-compaction",
      "lifecycleSource": "compact",
      "compactionMode": "automatic",
      "request": "Summarize the purpose of this README. Do not modify files.",
      "expectedRoute": "none",
      "observedRoute": null,
      "noRouteControl": true,
      "inspected": [],
      "mutationAttempted": false,
      "mutationObserved": false,
      "result": "not-run",
      "limitations": [
        "The bounded non-interactive validation did not produce a reviewable automatic-compaction event."
      ],
      "supportingOutput": []
    }
  ]
}
